code,name
45.19.2,Торговля розничная прочими автотранспортными средствами в специализированных магазинах
47.75.2,Торговля розничная туалетным и хозяйственным мылом в специализированных магазинах
45.19.3,Торговля розничная прочими автотранспортными средствами прочая
38.1,Сбор отходов
38.2,Обработка и утилизация отходов
80,Деятельность по обеспечению безопасности и проведению расследований
46.47.1,Торговля оптовая бытовой мебелью
46.47.2,Торговля оптовая осветительным оборудованием
86,Деятельность в области здравоохранения
46.47.3,Торговля оптовая коврами и ковровыми изделиями
87,Деятельность по уходу с обеспечением проживания
88,Предоставление социальных услуг без обеспечения проживания
14.11,Производство одежды из кожи
14.14,Производство нательного белья
66.19,Деятельность вспомогательная прочая в сфере финансовых услуг; кроме страхования и пенсионного обеспечения
14.12,Производство спецодежды
14.13,Производство прочей верхней одежды
25.30.21,Производство ядерных установок; кроме устройств для разделения изотопов
25.30.22,Производство частей ядерных установок; кроме устройств для разделения изотопов
03.1,Рыболовство
02.20,Лесозаготовки
03.2,Рыбоводство
30.20.4,Производство частей железнодорожных локомотивов; трамвайных и прочих моторных вагонов и подвижного состава; производство путевого оборудования и устройств для железнодорожных; трамвайных и прочих путей; механического и электромеханического оборудования для управления движением
56.29.4,Деятельность социальных столовых; буфетов или кафетериев (в офисах; больницах; школах; институтах и пр.) на основе льготных цен на питание
56.29.3,Деятельность по доставке продуктов питания учебным; спортивным и прочим учреждениям (по льготным ценам)
56.29.2,Деятельность столовых и буфетов при предприятиях и учреждениях
56.29.1,Деятельность организаций общественного питания; поставляющих готовую пищу (для транспортных и строительных компаний; туристическим группам; личному составу вооруженных сил; предприятиям розничной торговли и другим группам потребителей) по договору
14.19,Производство прочей одежды и аксессуаров одежды
30.20.9,Предоставление услуг по восстановлению и оснащению (завершению) железнодорожных локомотивов; трамвайных моторных вагонов и прочего подвижного состава
46.16.2,Деятельность агентов по оптовой торговле одеждой; изделиями из меха и обувью
66.11,Управление финансовыми рынками
66.12,Деятельность брокерская по сделкам с ценными бумагами и товарами
46.16.1,Деятельность агентов по оптовой торговле текстильными изделиями
14.20,Производство меховых изделий
66.29,Деятельность вспомогательная прочая в сфере страхования и пенсионного обеспечения
86.90,Деятельность в области медицины прочая
10.86.6,Производство диетических пищевых продуктов
71.12.63,Деятельность в области аккредитации
10.86.1,Производство молока и молочных продуктов для детского питания
71.12.64,Государственный контроль (надзор) за соблюдением требований технических регламентов
71.12.61,Деятельность в области технического регулирования и стандартизации
71.12.62,Деятельность в области метрологии
46.71,Торговля оптовая твердым; жидким и газообразным топливом и подобными продуктами
02.10,Лесоводство и прочая лесохозяйственная деятельность
46.72,Торговля оптовая металлами и металлическими рудами
28.30.89,Производство прочих машин и оборудования для сельского хозяйства; садоводства; птицеводства или пчеловодства; не включенных в другие группировки
28.30.81,Производство машин для очистки; сортировки или калибровки яиц; фруктов или прочих сельскохозяйственных продуктов; кроме семян; зерна или сухих бобовых культур
46.77,Торговля оптовая отходами и ломом
46.75,Торговля оптовая химическими продуктами
66.22,Деятельность страховых агентов и брокеров
14.13.1,Производство верхней трикотажной или вязаной одежды
46.76,Торговля оптовая прочими промежуточными продуктами
14.13.2,Производство верхней одежды из текстильных материалов; кроме трикотажных или вязаных
46.73,Торговля оптовая лесоматериалами; строительными материалами и санитарно-техническим оборудованием
66.21,Оценка рисков и ущерба
46.74,Торговля оптовая скобяными изделиями; водопроводным и отопительным оборудованием и принадлежностями
28.30.83,Производство оборудования для приготовления кормов для животных
52.10.9,Хранение и складирование прочих грузов
52.10.1,Хранение и складирование замороженных или охлажденных грузов
73.20.2,Деятельность по изучению общественного мнения
10.51.4,Производство молока и сливок в твердой форме
78.20,Деятельность агентств по временному трудоустройству
10.51.3,Производство сыра и сырных продуктов
10.51.9,Производство прочей молочной продукции
73.20.1,Исследование конъюнктуры рынка
52.10.3,Хранение и складирование зерна
63.99.1,Деятельность по оказанию консультационных и информационных услуг
52.10.2,Хранение и складирование жидких или газообразных грузов
25.2,Производство металлических цистерн; резервуаров и прочих емкостей
46.61,Торговля оптовая машинами; оборудованием и инструментами для сельского хозяйства
25.1,Производство строительных металлических конструкций и изделий
02.40,Предоставление услуг в области лесоводства и лесозаготовок
10.51.2,Производство сливочного масла; топленого масла; масляной пасты; молочного жира; спредов и топленых сливочно-растительных смесей
10.51.1,Производство питьевого молока и питьевых сливок
46.69,Торговля оптовая прочими машинами и оборудованием
66.30,Деятельность по управлению фондами
25.9,Производство прочих готовых металлических изделий
46.66,Торговля оптовая прочей офисной техникой и оборудованием
46.38.2,Торговля оптовая прочими пищевыми продуктами
46.64,Торговля оптовая машинами и оборудованием для текстильного; швейного и трикотажного производств
46.38.1,Торговля оптовая рыбой; ракообразными и моллюсками; консервами и пресервами из рыбы и морепродуктов
46.65,Торговля оптовая офисной мебелью
25.5,Ковка; прессование; штамповка и профилирование; изготовление изделий методом порошковой металлургии
46.62,Торговля оптовая станками
25.4,Производство оружия и боеприпасов
46.63,Торговля оптовая машинами и оборудованием для добычи полезных ископаемых и строительства
78.10,Деятельность агентств по подбору персонала
02.30,Сбор и заготовка пищевых лесных ресурсов; недревесных лесных ресурсов и лекарственных растений
46.51,Торговля оптовая компьютерами; периферийными устройствами к компьютерам и программным обеспечением
46.52,Торговля оптовая электронным и телекоммуникационным оборудованием и его запасными частями
10.92,Производство готовых кормов для домашних животных
46.48,Торговля оптовая часами и ювелирными изделиями
46.49,Торговля оптовая прочими бытовыми товарами
10.91,Производство готовых кормов для животных; содержащихся на фермах
47.3,Торговля розничная моторным топливом в специализированных магазинах
47.5,Торговля розничная прочими бытовыми изделиями в специализированных магазинах
02.10.2,Деятельность лесохозяйственная прочая
47.7,Торговля розничная прочими товарами в специализированных магазинах
47.8,Торговля розничная в нестационарных торговых объектах и на рынках
47.9,Торговля розничная вне магазинов; палаток; рынков
66.29.9,Деятельность вспомогательная прочая в сфере страхования; кроме обязательного социального страхования
49.39.11,Регулярные перевозки пассажиров автобусами в междугородном сообщении
46.46,Торговля оптовая фармацевтической продукцией
46.47,Торговля оптовая мебелью; коврами и осветительным оборудованием
46.44,Торговля оптовая изделиями из керамики и стекла и чистящими средствами
46.45,Торговля оптовая парфюмерными и косметическими товарами
46.42,Торговля оптовая одеждой и обувью
46.43,Торговля оптовая бытовыми электротоварами
47.1,Торговля розничная в неспециализированных магазинах
47.2,Торговля розничная пищевыми продуктами; напитками и табачными изделиями в специализированных магазинах
46.41,Торговля оптовая текстильными изделиями
91.04,Деятельность ботанических садов; зоопарков; государственных природных заповедников и национальных парков
24.10.14,Производство гранул и порошков из чугуна или стали
91.02,Деятельность музеев
24.10.12,Производство ферросплавов
91.03,Деятельность по охране исторических мест и зданий; памятников культуры
09.90,Предоставление услуг в других областях добычи полезных ископаемых
46.39,Торговля оптовая неспециализированная пищевыми продуктами; напитками и табачными изделиями
46.37,Торговля оптовая кофе; чаем; какао и пряностями
46.38,Торговля оптовая прочими пищевыми продуктами; включая рыбу; ракообразных и моллюсков
78.30,Деятельность по подбору персонала прочая
91.01,Деятельность библиотек и архивов
47.22.3,Торговля розничная консервами из мяса и мяса птицы в специализированных магазинах
47.22.1,Торговля розничная мясом и мясом птицы; включая субпродукты в специализированных магазинах
47.22.2,Торговля розничная продуктами из мяса и мяса птицы в специализированных магазинах
46.35,Торговля оптовая табачными изделиями
46.36,Торговля оптовая сахаром; шоколадом и сахаристыми кондитерскими изделиями
46.33,Торговля оптовая молочными продуктами; яйцами и пищевыми маслами и жирами
46.34,Торговля оптовая напитками
46.31,Торговля оптовая фруктами и овощами
46.32,Торговля оптовая мясом и мясными продуктами
10.71,Производство хлеба и мучных кондитерских изделий; тортов и пирожных недлительного хранения
71.12.57,Деятельность; связанная с активными воздействиями на метеорологические и геофизические процессы и явления
71.12.54,Работы полевые и изыскания в области гидрометеорологии и смежных с ней областях; экспедиционные обследования объектов окружающей среды с целью оценки уровней загрязнения
10.72,Производство сухарей; печенья и прочих сухарных хлебобулочных изделий; производство мучных кондитерских изделий; тортов; пирожных; пирогов и бисквитов; предназначенных для длительного хранения
71.12.55,Деятельность по обработке и предоставлению гидрометеорологической информации органам государственной власти и населению
50.20.3,Аренда морских судов заграничного и каботажного плавания для перевозки грузов с экипажем
50.20.1,Перевозка грузов морскими судами заграничного плавания
50.20.2,Перевозка грузов морскими судами каботажного плавания
71.12.52,Проведение гелиофизических и геофизических работ
71.12.53,Деятельность по мониторингу загрязнения окружающей среды для физических и юридических лиц
71.12.51,Деятельность наблюдательной гидрометеорологической сети
46.24,Торговля оптовая шкурами и кожей
46.22,Торговля оптовая цветами и растениями
46.23,Торговля оптовая живыми животными
46.21,Торговля оптовая зерном; необработанным табаком; семенами и кормами для сельскохозяйственных животных
69.1,Деятельность в области права
71.12.45,Создание геодезической; нивелирной; гравиметрической сетей
10.82,Производство какао; шоколада и сахаристых кондитерских изделий
10.81,Производство сахара
71.12.46,Землеустройство
46.19,Деятельность агентов по оптовой торговле универсальным ассортиментом товаров
10.84,Производство приправ и пряностей
71.12.43,Деятельность гидрографическая изыскательская
28.94.5,Производство составных частей и принадлежностей машин для текстильного и швейного производства и для обработки кож
10.83,Производство чая и кофе
71.12.44,Деятельность по созданию топографических карт и планов
46.17,Деятельность агентов по оптовой торговле пищевыми продуктами; напитками и табачными изделиями
10.86,Производство детского питания и диетических пищевых продуктов
46.18,Деятельность агентов; специализирующихся на оптовой торговле прочими отдельными видами товаров
10.85,Производство готовых пищевых продуктов и блюд
46.15,Деятельность агентов по оптовой торговле мебелью; бытовыми товарами; скобяными; ножевыми и прочими металлическими изделиями
46.16,Деятельность агентов по оптовой торговле текстильными изделиями; одеждой; обувью; изделиями из кожи и меха
52.23.1,Деятельность вспомогательная; связанная с воздушным транспортом
52.23.2,Деятельность вспомогательная; связанная с космическим транспортом
71.12.41,Деятельность геодезическая; кроме создания геодезической; нивелирной и гравиметрической сетей
71.12.42,Деятельность картографическая; кроме создания топографических карт и планов
66.29.1,Деятельность страховых актуариев
28.94.2,Производство прочего оборудования для текстильной и швейной промышленности; в том числе промышленных швейных машин
66.29.2,Деятельность распорядителей спасательными работами
28.94.1,Производство оборудования для подготовки; прядения текстильных волокон; производства тканых и трикотажных текстильных изделий
47.79.1,Торговля розничная предметами антиквариата
47.79.3,Торговля розничная прочими бывшими в употреблении товарами
46.13,Деятельность агентов по оптовой торговле лесоматериалами и строительными материалами
10.89,Производство прочих пищевых продуктов; не включенных в другие группировки
46.14,Деятельность агентов по оптовой торговле машинами; промышленным оборудованием; судами и летательными аппаратами
46.11,Деятельность агентов по оптовой торговле сельскохозяйственным сырьем; живыми животными; текстильным сырьем и полуфабрикатами
46.12,Деятельность агентов по оптовой торговле топливом; рудами; металлами и химическими веществами
52.10,Деятельность по складированию и хранению
47.52.71,Торговля розничная пиломатериалами в специализированных магазинах
10.71.2,Производство мучных кондитерских изделий; тортов и пирожных недлительного хранения
10.71.1,Производство хлеба и хлебобулочных изделий недлительного хранения
47.52.73,Торговля розничная металлическими и неметаллическими конструкциями в специализированных магазинах
47.52.79,Торговля розничная прочими строительными материалами; не включенными в другие группировки; в специализированных магазинах
27.40,Производство электрических ламп и осветительного оборудования
53.10.1,Деятельность почтовой связи; связанная с пересылкой газет и других периодических изданий
53.10.2,Деятельность почтовой связи; связанная с пересылкой письменной корреспонденции
53.10.4,Деятельность почтовой связи дополнительная
53.10.9,Деятельность почтовой связи общего пользования прочая
52.23,Деятельность вспомогательная; связанная с воздушным и космическим транспортом
52.24,Транспортная обработка грузов
52.21,Деятельность вспомогательная; связанная с сухопутным транспортом
52.22,Деятельность вспомогательная; связанная с водным транспортом
46.49.31,Торговля оптовая книгами
52.29,Деятельность вспомогательная прочая; связанная с перевозками
56.1,Деятельность ресторанов и услуги по доставке продуктов питания
27.52,Производство бытовых неэлектрических приборов
