code,name
05.10.15,Добыча коксующегося угля подземным способом
86.21,Общая врачебная практика
05.10.16,Добыча угля; за исключением антрацита; угля коксующегося и угля бурого; подземным способом
05.10.13,Добыча угля; за исключением антрацита; угля коксующегося и угля бурого; открытым способом
05.10.14,Добыча антрацита подземным способом
05.10.11,Добыча антрацита открытым способом
05.10.12,Добыча коксующегося угля открытым способом
74.30,Деятельность по письменному и устному переводу
05.10,Добыча и обогащение угля и антрацита
45.1,Торговля автотранспортными средствами
45.2,Техническое обслуживание и ремонт автотранспортных средств
45.3,Торговля автомобильными деталями; узлами и принадлежностями
86.22,Специальная врачебная практика
86.23,Стоматологическая практика
46.61.2,Торговля оптовая садово-огородной техникой и инвентарем
86.10,Деятельность больничных организаций
46.61.1,Торговля оптовая сельскохозяйственными и лесохозяйственными машинами; оборудованием и инструментами; включая тракторы
64.92.3,Деятельность по предоставлению денежных ссуд под залог недвижимого имущества
64.92.2,Деятельность по предоставлению займов промышленности
46.72.23,Торговля оптовая золотом и другими драгоценными металлами
64.92.1,Деятельность по предоставлению потребительского кредита
17.11,Производство целлюлозы и древесной массы
17.12,Производство бумаги и картона
13.20.46,Производство тканей из стекловолокна
46.72.22,Торговля оптовая цветными металлами в первичных формах; кроме драгоценных
46.72.21,Торговля оптовая черными металлами в первичных формах
10.6,Производство продуктов мукомольной и крупяной промышленности; крахмала и крахмалосодержащих продуктов
22.19.1,Производство регенерированной резины в первичной форме или в виде пластин; листов или полос (лент)
10.82.2,Производство шоколада и сахаристых кондитерских изделий
10.5,Производство молочной продукции
22.19.3,Производство труб; трубок; рукавов и шлангов из вулканизированной резины
10.4,Производство растительных и животных масел и жиров
10.3,Переработка и консервирование фруктов и овощей
22.19.2,Производство резиновых смесей и изделий из них; производство вулканизированной резины в виде нити; корда; пластин; листов; полос; прутков и профилей
10.2,Переработка и консервирование рыбы; ракообразных и моллюсков
10.1,Переработка и консервирование мяса и мясной пищевой продукции
22.19.4,Производство конвейерных лент и приводных ремней; бельтинга из вулканизированной резины
22.19.7,Производство изделий из вулканизированной резины; не включенных в другие группировки
22.19.6,Производство предметов одежды и ее аксессуаров из вулканизированной резины
64.92.7,Деятельность микрофинансовая
10.9,Производство готовых кормов для животных
10.8,Производство прочих пищевых продуктов
47.81.1,Торговля розничная в нестационарных торговых объектах напитками и табачной продукцией
72.19.4,Научные исследования и разработки в области защиты информации
13.20.13,Производство льняных тканей
46.72.11,Торговля оптовая железными рудами
72.19.9,Научные исследования и разработки в области естественных и технических наук прочие; не включенные в другие группировки
49.50,Деятельность трубопроводного транспорта
08.99.2,Добыча абразивных материалов; асбеста; кремнеземистой каменной муки; природных графитов; мыльного камня (талька); полевого шпата и т. д.
03.12.2,Рыболовство пресноводное в целях аквакультуры (рыбоводства)
45.32.2,Торговля розничная автомобильными деталями; узлами и принадлежностями прочая
49.42,Предоставление услуг по перевозкам
32.5,Производство медицинских инструментов и оборудования
49.41,Деятельность автомобильного грузового транспорта
25.99,Производство прочих готовых металлических изделий; не включенных в другие группировки
32.3,Производство спортивных товаров
10.41.24,Производство нерафинированного подсолнечного масла и его фракций
25.91,Производство металлических бочек и аналогичных емкостей
45.32.1,Торговля розничная автомобильными деталями; узлами и принадлежностями в специализированных магазинах
25.93,Производство изделий из проволоки; цепей и пружин
25.92,Производство тары из легких металлов
32.9,Производство изделий; не включенных в другие группировки
03.12.1,Рыболовство пресноводное промышленное
25.94,Производство крепежных изделий
50.40.1,Перевозка грузов по внутренним водным путям
46.52.1,Торговля оптовая телекоммуникационным оборудованием и его запасными частями
46.52.2,Торговля оптовая электронным оборудованием и его запасными частями
49.31,Деятельность сухопутного пассажирского транспорта: перевозки пассажиров в городском и пригородном сообщении
10.73.1,Производство макаронных изделий
49.39,Деятельность прочего сухопутного пассажирского транспорта; не включенная в другие группировки
25.62,Обработка металлических изделий механическая
25.61,Обработка металлов и нанесение покрытий на металлы
49.32,Деятельность легкового такси и арендованных легковых автомобилей с водителем
13.95,Производство нетканых текстильных материалов и изделий из них; кроме одежды
13.96,Производство прочих технических и промышленных текстильных изделий
13.99,Производство прочих текстильных изделий; не включенных в другие группировки
28.30.8,Производство прочих машин и оборудования для сельского и лесного хозяйства
28.30.5,Производство машин для уборки урожая
28.30.3,Производство машин и сельскохозяйственного оборудования для обработки почвы
13.94,Производство канатов; веревок; шпагата и сетей
28.30.2,Производство тракторов для сельского хозяйства
13.91,Производство трикотажного и вязаного полотна
13.92,Производство готовых текстильных изделий; кроме одежды
49.20,Деятельность железнодорожного транспорта: грузовые перевозки
47.29.34,Торговля розничная солью в специализированных магазинах
47.30.12,Торговля розничная газом для заправки автомобилей в специализированных магазинах
47.30.11,Торговля розничная бензином и дизельным топливом в специализированных магазинах
47.29.36,Торговля розничная гомогенизированными пищевыми продуктами; детским и диетическим питанием в специализированных магазинах
47.29.35,Торговля розничная чаем; кофе; какао в специализированных магазинах
47.29.31,Торговля розничная мукой и макаронными изделиями в специализированных магазинах
25.71,Производство ножевых изделий и столовых приборов
25.73,Производство инструмента
25.72,Производство замков и петель
26.30.17,Производство радио- и телевизионной передающей аппаратуры
26.30.16,Производство оборудования средств связи; в том числе программное обеспечение; обеспечивающее выполнение установленных действий при проведении оперативно-розыскных мероприятий
47.59.9,Торговля розничная бытовыми изделиями и приборами; не включенными в другие группировки; в специализированных магазинах
46.74.3,Торговля оптовая ручными инструментами
46.74.2,Торговля оптовая водопроводным и отопительным оборудованием и санитарно-технической арматурой
26.30.13,Производство средств связи; выполняющих функцию систем управления и мониторинга
46.74.1,Торговля оптовая скобяными изделиями
26.30.11,Производство средств связи; выполняющих функцию систем коммутации
47.59.5,Торговля розничная музыкальными инструментами и нотными изданиями в специализированных магазинах
47.59.4,Торговля розничная изделиями из дерева; пробки и плетеными изделиями в специализированных магазинах
47.59.3,Торговля розничная осветительными приборами в специализированных магазинах
47.59.2,Торговля розничная различной домашней утварью; ножевыми изделиями; посудой; изделиями из стекла и керамики; в том числе фарфора и фаянса в специализированных магазинах
47.59.1,Торговля розничная мебелью в специализированных магазинах
47.29.39,Торговля розничная прочими пищевыми продуктами в специализированных магазинах; не включенными в другие группировки
26.60.9,Производство прочего оборудования; применяемого в медицинских целях
26.60.4,Производство инструмента; оборудования и приспособлений; применяемых в медицинских целях
26.60.5,Производство диагностического и терапевтического оборудования; применяемого в медицинских целях
26.60.2,Производство гемодиализного; диатермического; наркозного оборудования; применяемого в медицинских целях
74.90,Деятельность профессиональная; научная и техническая прочая; не включенная в другие группировки
11.01.4,Производство пищевого спирта
26.60.1,Производство аппаратов; применяемых в медицинских целях; основанных на использовании рентгеновского; альфа-; бета- и гамма-излучений
25.40,Производство оружия и боеприпасов
11.01.1,Производство дистиллированных питьевых алкогольных напитков: водки; виски; бренди; джина; ликеров и т. п.
49.10,Деятельность железнодорожного транспорта: междугородные и международные пассажирские перевозки
35.22.11,Распределение природного; сухого (отбензиненного) газа по газораспределительным сетям по тарифам; регулируемым государством
50.20.32,Аренда морских судов каботажного плавания для перевозки грузов с экипажем
24.20.3,Производство стальных фитингов для труб; кроме литых
25.50,Ковка; прессование; штамповка и профилирование; изготовление изделий методом порошковой металлургии
46.11.35,Деятельность агентов по оптовой торговле текстильным сырьем и полуфабрикатами
46.11.34,Деятельность агентов по оптовой торговле кормами для сельскохозяйственных животных
46.11.31,Деятельность агентов по оптовой торговле зерном
46.11.32,Деятельность агентов по оптовой торговле семенами; кроме семян масличных культур
41.2,Строительство жилых и нежилых зданий
46.11.39,Деятельность агентов по оптовой торговле прочими сельскохозяйственным сырьем и сельскохозяйственными полуфабрикатами; не включенными в другие группировки
25.93.1,Производство изделий из проволоки и пружин
47.72.1,Торговля розничная обувью в специализированных магазинах
49.31.21,Регулярные перевозки пассажиров автобусами в городском и пригородном сообщении
49.31.22,Регулярные перевозки пассажиров троллейбусами в городском и пригородном сообщении
42.22,Строительство коммунальных объектов для обеспечения электроэнергией и телекоммуникациями
30.40,Производство военных боевых машин
47.19.2,Деятельность универсальных магазинов; торгующих товарами общего ассортимента
47.19.1,Торговля розничная большим товарным ассортиментом с преобладанием непродовольственных товаров в неспециализированных магазинах
49.31.23,Регулярные перевозки пассажиров трамваями в городском и пригородном сообщении
49.31.24,Перевозка пассажиров метрополитеном
08.11.3,Добыча мела и некальцинированного доломита
50.10,Деятельность морского пассажирского транспорта
08.11.2,Добыча и первичная обработка известняка и гипсового камня
63.1,Деятельность по обработке данных; предоставление услуг по размещению информации; деятельность порталов в информационно-коммуникационной сети Интернет
42.21,Строительство инженерных коммуникаций для водоснабжения и водоотведения; газоснабжения
35.12.1,Передача электроэнергии
62.01,Разработка компьютерного программного обеспечения
49.31.11,Перевозка пассажиров железнодорожным транспортом в пригородном сообщении в регулируемом секторе
42.11,Строительство автомобильных дорог и автомагистралей
62.02,Деятельность консультативная и работы в области компьютерных технологий
42.12,Строительство железных дорог и метро
62.03,Деятельность по управлению компьютерным оборудованием
42.13,Строительство мостов и тоннелей
28.12.1,Производство гидравлических и пневматических силовых установок и двигателей
62.09,Деятельность; связанная с использованием вычислительной техники и информационных технологий; прочая
30.30,Производство летательных аппаратов; включая космические; и соответствующего оборудования
28.12.2,Производство гидравлических насосов
47.78.63,Торговля розничная газом в баллонах в специализированных магазинах по нерегулируемым государством ценам (тарифам)
47.78.62,Торговля розничная газом в баллонах в специализированных магазинах по регулируемым государствам ценам (тарифам)
26.51.8,Производство частей приборов и инструментов для навигации; управления; измерения; контроля; испытаний и прочих целей
47.78.61,Торговля розничная бытовым жидким котельным топливом; углем; древесным топливом; топливным торфом в специализированных магазинах
26.51.6,Производство прочих приборов; датчиков; аппаратуры и инструментов для измерения; контроля и испытаний
50.20,Деятельность морского грузового транспорта
68.10.2,Покупка и продажа собственного недвижимого имущества
68.10.1,Подготовка к продаже собственного недвижимого имущества
26.51.7,Производство приборов и аппаратуры для автоматического регулирования или управления
26.51.4,Производство приборов и аппаратуры для измерения электрических величин или ионизирующих излучений
26.51.5,Производство приборов для контроля прочих физических величин
26.51.2,Производство радиолокационной; радионавигационной аппаратуры и радиоаппаратуры дистанционного управления
26.51.3,Производство точных весов; производство ручных инструментов для черчения; разметки и математических расчетов; производство ручных инструментов для измерения линейных размеров; не включенных в другие группировки
26.51.1,Производство навигационных; метеорологических; геодезических; геофизических и аналогичного типа приборов; аппаратуры и инструментов
28.92.26,Производство одноковшовых полноповоротных экскаваторов и погрузчиков
03.21.4,Воспроизводство морских биоресурсов искусственное
71.12.4,Деятельность геодезическая и картографическая
58.11.3,Издание атласов; карт и таблиц; в том числе для слепых; в печатном виде
71.12.3,Работы геолого-разведочные; геофизические и геохимические в области изучения недр и воспроизводства минерально-сырьевой базы
71.12.2,Деятельность заказчика-застройщика; генерального подрядчика
30.20,Производство железнодорожных локомотивов и подвижного состава
71.12.1,Деятельность; связанная с инженерно-техническим проектированием; управлением проектами строительства; выполнением строительного контроля и авторского надзора
71.12.8,Деятельность по предоставлению инженерно-технических консультаций по энергосбережению и повышению энергетической эффективности
71.12.7,Кадастровая деятельность
71.12.6,Деятельность в области технического регулирования; стандартизации; метрологии; аккредитации; каталогизации продукции
71.12.5,Деятельность в области гидрометеорологии и смежных с ней областях; мониторинга состояния окружающей среды; ее загрязнения
50.30,Деятельность внутреннего водного пассажирского транспорта
58.11.1,Издание книг; брошюр; рекламных буклетов и аналогичных изданий; включая издание словарей и энциклопедий; в том числе для слепых; в печатном виде
