code,name
47.52.7,Торговля розничная строительными материалами; не включенными в другие группировки; в специализированных магазинах
47.52.6,Торговля розничная садово-огородной техникой и инвентарем в специализированных магазинах
47.52.5,Торговля розничная санитарно-техническим оборудованием в специализированных магазинах
68.20.2,Аренда и управление собственным или арендованным нежилым недвижимым имуществом
68.20.1,Аренда и управление собственным или арендованным жилым недвижимым имуществом
47.52.3,Торговля розничная стеклом в специализированных магазинах
47.52.2,Торговля розничная лакокрасочными материалами в специализированных магазинах
28.49.4,Производство делительных головок и прочих специальных приспособлений для станков
47.52.1,Торговля розничная скобяными изделиями в специализированных магазинах
28.49.2,Производство оборудования для нанесения гальванического покрытия
59.14,Деятельность в области демонстрации кинофильмов
59.13,Деятельность по распространению кинофильмов; видеофильмов и телевизионных программ
47.74.1,Торговля розничная изделиями; применяемыми в медицинских целях; в специализированных магазинах
47.74.2,Торговля розничная ортопедическими изделиями в специализированных магазинах
59.12,Деятельность монтажно-компоновочная в области производства кинофильмов; видеофильмов и телевизионных программ
59.11,Производство кинофильмов; видеофильмов и телевизионных программ
84.25.9,Деятельность по обеспечению безопасности в чрезвычайных ситуациях прочая
01.45.1,Разведение овец и коз
01.45.2,Производство сырого овечьего и козьего молока
43.39,Производство прочих отделочных и завершающих работ
32.99.1,Производство головных защитных уборов и прочих средств защиты
43.34,Производство малярных и стекольных работ
32.99.5,Производство зажигалок и прочих курительных принадлежностей
32.99.3,Производство зонтов; тростей; пуговиц; кнопок; застежек-молний
32.99.9,Производство прочих изделий; не включенных в другие группировки
32.99.8,Производство изделий народных художественных промыслов
47.24.22,Торговля розничная кондитерскими изделиями; включая шоколад; в специализированных магазинах
32.99.7,Производство приборов; аппаратуры и моделей; предназначенных для демонстрационных целей
47.24.21,Торговля розничная мучными кондитерскими изделиями в специализированных магазинах
59.20,Деятельность в области звукозаписи и издания музыкальных произведений
08.99.31,Добыча драгоценных и полудрагоценных камней; кроме алмазов
08.99.32,Добыча алмазов
01.42.12,Разведение племенного мясного и прочего крупного рогатого скота; включая буйволов; яков и др.
43.31,Производство штукатурных работ
43.32,Работы столярные и плотничные
49.39.1,Регулярные перевозки пассажиров сухопутным транспортом; кроме железнодорожного транспорта
43.33,Работы по устройству покрытий полов и облицовке стен
74.90.99,Деятельность в области защиты информации прочая
49.39.2,Перевозка пассажиров фуникулерами; подвесными канатными дорогами и лыжными подъемниками; не являющимися частью внутригородской; пригородной или городской и пригородной транспортных систем
60.10,Деятельность в области радиовещания
49.39.3,Перевозки пассажиров сухопутным транспортом по заказам
01.42.11,Разведение мясного и прочего крупного рогатого скота; включая буйволов; яков и др.; на мясо
43.29,Производство прочих строительно-монтажных работ
43.21,Производство электромонтажных работ
43.22,Производство санитарно-технических работ; монтаж отопительных систем и систем кондиционирования воздуха
60.20,Деятельность в области телевизионного вещания
31.09.1,Производство прочей мебели; кроме изготовленной по индивидуальному заказу населения
31.09.2,Изготовление прочей мебели и отдельных мебельных деталей; не включенных в другие группировки по индивидуальному заказу населения
66.19.5,Предоставление услуг по хранению ценностей; депозитарная деятельность
66.19.4,Деятельность по предоставлению консультационных услуг по вопросам финансового посредничества
66.19.7,Рейтинговая деятельность
66.19.6,Деятельность по приему платежей физических лиц платежными агентами
66.19.1,Деятельность по предоставлению брокерских услуг по ипотечным операциям
20.30.1,Производство красок и лаков на основе полимеров
26.1,Производство элементов электронной аппаратуры и печатных схем (плат)
47.51,Торговля розничная текстильными изделиями в специализированных магазинах
20.30.2,Производство прочих красок; лаков; эмалей и аналогичных материалов для нанесения покрытий; художественных и полиграфических красок
47.59,Торговля розничная мебелью; осветительными приборами и прочими бытовыми изделиями в специализированных магазинах
26.7,Производство оптических приборов; фото- и кинооборудования
47.54,Торговля розничная бытовыми электротоварами в специализированных магазинах
26.5,Производство контрольно-измерительных и навигационных приборов и аппаратов; производство часов
26.4,Производство бытовой электроники
47.52,Торговля розничная скобяными изделиями; лакокрасочными материалами и стеклом в специализированных магазинах
26.3,Производство коммуникационного оборудования
23.19.9,Производство прочих изделий из стекла; не включенных в другие группировки
26.2,Производство компьютеров и периферийного оборудования
55.10,Деятельность гостиниц и прочих мест для временного проживания
23.99,Производство прочей неметаллической минеральной продукции; не включенной в другие группировки
85.22.2,Образование высшее - специалитет
85.22.1,Образование высшее - бакалавриат
47.43,Торговля розничная аудио- и видеотехникой в специализированных магазинах
23.91,Производство абразивных изделий
47.41,Торговля розничная компьютерами; периферийными устройствами к ним и программным обеспечением в специализированных магазинах
47.42,Торговля розничная телекоммуникационным оборудованием; включая розничную торговлю мобильными телефонами; в специализированных магазинах
84.25.1,Деятельность по обеспечению пожарной безопасности
87.90,Деятельность по уходу с обеспечением проживания прочая
23.69,Производство прочих изделий из гипса; бетона или цемента
55.20,Деятельность по предоставлению мест для краткосрочного проживания
23.61,Производство изделий из бетона для использования в строительстве
03.12,Рыболовство пресноводное
23.62,Производство гипсовых изделий для использования в строительстве
46.15.9,Деятельность агентов по оптовой торговле прочими бытовыми товарами; не включенными в другие группировки
23.63,Производство товарного бетона
23.64,Производство сухих бетонных смесей
13.92.1,Производство готовых текстильных изделий; кроме одежды
11.07.2,Производство безалкогольных напитков ароматизированных и/или с добавлением сахара; кроме минеральных вод
23.65,Производство изделий из хризотилцемента и волокнистого цемента
11.07.1,Производство минеральных вод
03.11,Рыболовство морское
46.15.1,Деятельность агентов по оптовой торговле мебелью
46.15.3,Деятельность агентов по оптовой торговле электротоварами и бытовыми электроустановочными изделиями
46.15.2,Деятельность агентов по оптовой торговле скобяными; ножевыми и прочими бытовыми металлическими изделиями
47.30,Торговля розничная моторным топливом в специализированных магазинах
46.15.4,Деятельность агентов по оптовой торговле радио- и телеаппаратурой; техническими носителями информации
30.20.31,Производство транспортных средств для ремонта и технического обслуживания железнодорожных; трамвайных и прочих путей
30.20.33,Производство несамоходных железнодорожных; трамвайных и прочих вагонов для перевозки грузов
47.29,Торговля розничная прочими пищевыми продуктами в специализированных магазинах
55.30,Деятельность по предоставлению мест для временного проживания в кемпингах; жилых автофургонах и туристических автоприцепах
13.2,Производство текстильных тканей
13.1,Подготовка и прядение текстильных волокон
47.25,Торговля розничная напитками в специализированных магазинах
47.26,Торговля розничная табачными изделиями в специализированных магазинах
13.9,Производство прочих текстильных изделий
47.24,Торговля розничная хлебом и хлебобулочными изделиями и кондитерскими изделиями в специализированных магазинах
47.21,Торговля розничная фруктами и овощами в специализированных магазинах
27.11.11,Производство электродвигателей
47.22,Торговля розничная мясом и мясными продуктами в специализированных магазинах
14.14.1,Производство трикотажного и вязаного нательного белья
14.14.2,Производство нательного белья из тканей
23.70,Резка; обработка и отделка камня
47.19,Торговля розничная прочая в неспециализированных магазинах
23.49,Производство прочих керамических изделий
79.12,Деятельность туроператоров
79.11,Деятельность туристических агентств
35.30,Производство; передача и распределение пара и горячей воды; кондиционирование воздуха
23.41,Производство хозяйственных и декоративных керамических изделий
23.42,Производство керамических санитарно-технических изделий
23.43,Производство керамических изоляторов и изолирующей арматуры
23.44,Производство прочих технических керамических изделий
74.90.32,Предоставление услуг по проведению оценки уязвимости объектов промышленного назначения; связи; здравоохранения и т. д.
74.90.31,Предоставление услуг по проведению оценки уязвимости объектов транспортной инфраструктуры и транспортных средств
47.11,Торговля розничная преимущественно пищевыми продуктами; включая напитки; и табачными изделиями в неспециализированных магазинах
25.99.2,Производство прочих металлических изделий
25.99.1,Производство металлических изделий для ванных комнат и кухни
52.24.1,Транспортная обработка контейнеров
35.23,Торговля газообразным топливом; подаваемым по распределительным сетям
35.22,Распределение газообразного топлива по газораспределительным сетям
52.24.2,Транспортная обработка прочих грузов
35.21,Производство газа
47.78.1,Торговля розничная фотоаппаратурой; оптическими приборами и средствами измерений; кроме очков; в специализированных магазинах
47.78.2,Торговля розничная очками; включая сборку и ремонт очков в специализированных магазинах
35.3,Производство; передача и распределение пара и горячей воды; кондиционирование воздуха
01.49.5,Разведение домашних животных
01.49.4,Разведение оленей
23.51,Производство цемента
47.78.3,Торговля розничная сувенирами; изделиями народных художественных промыслов
35.2,Производство и распределение газообразного топлива
35.1,Производство; передача и распределение электроэнергии
23.52,Производство извести и гипса
47.78.4,Торговля розничная предметами культового и религиозного назначения; похоронными принадлежностями в специализированных магазинах
47.78.5,Деятельность коммерческих художественных галерей; торговля розничная произведениями искусства в коммерческих художественных галереях
47.78.6,Торговля розничная бытовым жидким котельным топливом; газом в баллонах; углем; древесным топливом; топливным торфом в специализированных магазинах
01.49.9,Разведение прочих животных; не включенных в другие группировки
47.78.7,Торговля розничная оружием и боеприпасами в специализированных магазинах
47.78.8,Торговля розничная филателистическими и нумизматическими товарами в специализированных магазинах
62.02.1,Деятельность по планированию; проектированию компьютерных систем
47.78.9,Торговля розничная непродовольственными товарами; не включенными в другие группировки; в специализированных магазинах
62.02.2,Деятельность по обследованию и экспертизе компьютерных систем
62.02.4,Деятельность по подготовке компьютерных систем к эксплуатации
25.99.3,Изготовление готовых металлических изделий хозяйственного назначения по индивидуальному заказу населения
01.49.1,Пчеловодство
62.02.9,Деятельность консультативная в области компьютерных технологий прочая
01.49.2,Разведение кроликов и прочих пушных зверей на фермах
42.22.2,Строительство местных линий электропередачи и связи
42.22.3,Строительство электростанций
42.22.1,Строительство междугородних линий электропередачи и связи
95.22.1,Ремонт бытовой техники
35.14,Торговля электроэнергией
35.13,Распределение электроэнергии
35.12,Передача электроэнергии и технологическое присоединение к распределительным электросетям
35.11,Производство электроэнергии
23.20,Производство огнеупорных изделий
01.49.22,Разведение прочих пушных зверей на фермах
80.20,Деятельность систем обеспечения безопасности
23.19.7,Производство электрических изоляторов из стекла
23.19.5,Производство посуды для лабораторных; фармацевтических и гигиенических целей из стекла; производство ампул и прочих изделий из медицинского стекла
23.19.6,Производство стеклянных деталей электрических ламп и осветительной арматуры; световых указателей; световых табло и аналогичных изделий
23.19.2,Производство блоков для мощения; стеклоблоков; плит и прочих изделий из прессованного или отформованного стекла; используемых в строительстве; производство стекла для витражей; производство многоячеистого стекла или пеностекла в блоках; плитах и аналогичных формах
10.41.5,Производство рафинированных растительных масел и их фракций
10.41.2,Производство нерафинированных растительных масел и их фракций
23.31,Производство керамических плит и плиток
23.32,Производство кирпича; черепицы и прочих строительных изделий из обожженной глины
74.90.21,Деятельность; направленная на установление рыночной или иной стоимости отдельных материальных объектов (вещей)
74.90.23,Деятельность; направленная на установление рыночной или иной стоимости права собственности или иных вещных прав на имущество или отдельные вещи из состава имущества
74.90.22,Деятельность; направленная на установление рыночной или иной стоимости совокупности вещей; составляющих имущество лица; в том числе имущество определенного вида (движимое или недвижимое; в том числе предприятия)
80.10,Деятельность частных охранных служб
24.10.5,Производство листового холоднокатаного стального проката; плакированного; с гальваническим или иным покрытием
24.10.6,Производство сортового горячекатаного проката и катанки
24.10.3,Производство листового горячекатаного стального проката
24.10.4,Производство листового холоднокатаного стального проката
24.10.9,Производство прочего проката из черных металлов; не включенного в другие группировки
28.13,Производство прочих насосов и компрессоров
28.14,Производство арматуры трубопроводной
28.11,Производство двигателей и турбин; кроме авиационных; автомобильных и мотоциклетных двигателей
28.12,Производство гидравлического и пневматического силового оборудования
22.2,Производство изделий из пластмасс
22.1,Производство резиновых изделий
28.15,Производство подшипников; зубчатых передач; элементов механических передач и приводов
