code,name
02.1,Лесоводство и прочая лесохозяйственная деятельность
45.40.2,Торговля розничная мотоциклами; их деталями; составными частями и принадлежностями в специализированных магазинах
45.40.1,Торговля оптовая мотоциклами; их деталями; узлами и принадлежностями
45.40.3,Торговля розничная мотоциклами; их деталями; узлами и принадлежностями прочая
01.70,Охота; отлов и отстрел диких животных; включая предоставление услуг в этих областях
68.10.23,Покупка и продажа земельных участков
13.30,Отделка тканей и текстильных изделий
68.10.21,Покупка и продажа собственного жилого недвижимого имущества
68.10.22,Покупка и продажа собственных нежилых зданий и помещений
77.40,Аренда интеллектуальной собственности и подобной продукции; кроме авторских прав
01.63,Деятельность сельскохозяйственная после сбора урожая
47.23.1,Торговля розничная рыбой и морепродуктами в специализированных магазинах
25.11,Производство строительных металлических конструкций; изделий и их частей
01.62,Предоставление услуг в области животноводства
01.61,Предоставление услуг в области растениеводства
25.12,Производство металлических дверей и окон
19.20.9,Производство прочих нефтепродуктов
19.20.2,Разделение и извлечение фракций из нефтяного (попутного) газа
59.1,Производство кинофильмов; видеофильмов и телевизионных программ
01.19,Выращивание прочих однолетних культур
24.3,Производство прочих стальных изделий первичной обработкой
24.1,Производство чугуна; стали и ферросплавов
01.13,Выращивание овощей; бахчевых; корнеплодных и клубнеплодных культур; грибов и трюфелей
01.12,Выращивание риса
01.11,Выращивание зерновых (кроме риса); зернобобовых культур и семян масличных культур
24.5,Литье металлов
24.4,Производство основных драгоценных металлов и прочих цветных металлов; производство ядерного топлива
13.10,Подготовка и прядение текстильных волокон
50.10.1,Перевозка пассажиров морскими судами заграничного плавания
46.38.29,Торговля оптовая прочими пищевыми продуктами; не включенными в другие группировки
30.30.5,Производство частей и принадлежностей летательных и космических аппаратов
46.38.26,Торговля оптовая мороженым и замороженными десертами
30.30.2,Производство аэростатов; дирижаблей; планеров; дельтапланов и прочих безмоторных летательных аппаратов
30.30.3,Производство вертолетов; самолетов и прочих летательных аппаратов
46.38.25,Торговля оптовая солью
23.99.61,Производство минеральных теплоизоляционных материалов и изделий
46.4,Торговля оптовая непродовольственными потребительскими товарами
01.30,Выращивание рассады
28.29.6,Производство оборудования для обработки материалов с использованием процессов; включающих изменение температуры; не включенного в другие группировки
46.5,Торговля оптовая информационным и коммуникационным оборудованием
46.6,Торговля оптовая прочими машинами; оборудованием и принадлежностями
28.29.3,Производство промышленного; бытового и прочего оборудования для взвешивания и дозировки
46.7,Торговля оптовая специализированная прочая
28.29.1,Производство газогенераторов; аппаратов для дистилляции и фильтрования
46.9,Торговля оптовая неспециализированная
46.17.1,Деятельность агентов по оптовой торговле пищевыми продуктами
46.1,Торговля оптовая за вознаграждение или на договорной основе
28.29.7,Производство неэлектрического оборудования и инструментов для пайки мягким и твердым припоем или сварки; машин и аппаратов для газотермического напыления
46.2,Торговля оптовая сельскохозяйственным сырьем и живыми животными
46.3,Торговля оптовая пищевыми продуктами; напитками и табачными изделиями
64.91.2,Деятельность по финансовой аренде (лизингу/сублизингу) в прочих областях; кроме племенных животных
14.12.1,Производство спецодежды; кроме изготовленных по индивидуальному заказу
70.10.2,Деятельность по управлению холдинг-компаниями
70.10.1,Деятельность по управлению финансово-промышленными группами
01.25,Выращивание прочих плодовых деревьев; кустарников и орехов
01.24,Выращивание семечковых и косточковых культур
79.90.3,Деятельность по предоставлению туристических услуг; связанных с бронированием
11.0,Производство напитков
01.23,Выращивание цитрусовых культур
01.21,Выращивание винограда
79.90.2,Деятельность по предоставлению экскурсионных туристических услуг
79.90.1,Деятельность по предоставлению туристических информационных услуг
45.40,Торговля мотоциклами; их деталями; узлами и принадлежностями; техническое обслуживание и ремонт мотоциклов
14.12.2,Пошив производственной одежды по индивидуальному заказу населения
46.73.1,Торговля оптовая древесным сырьем и необработанными лесоматериалами
66.30.9,Другие виды деятельности по управлению активами
45.20.3,Мойка автотранспортных средств; полирование и предоставление аналогичных услуг
46.73.5,Торговля оптовая листовым стеклом
46.73.4,Торговля оптовая лакокрасочными материалами
46.73.3,Торговля оптовая санитарно-техническим оборудованием
46.73.2,Торговля оптовая пиломатериалами
28.29.31,Производство промышленного оборудования для взвешивания и дозировки
07.10.2,Добыча железных руд открытым способом
75.00,Деятельность ветеринарная
66.30.1,Управление инвестиционными фондами
46.73.8,Торговля оптовая напольными покрытиями (кроме ковров)
45.20.1,Техническое обслуживание и ремонт легковых автомобилей и легких грузовых автотранспортных средств
26.70,Производство оптических приборов; фото- и кинооборудования
46.73.7,Торговля оптовая обоями
45.20.2,Техническое обслуживание и ремонт прочих автотранспортных средств
46.73.6,Торговля оптовая прочими строительными материалами и изделиями
68.1,Покупка и продажа собственного недвижимого имущества
68.3,Операции с недвижимым имуществом за вознаграждение или на договорной основе
68.2,Аренда и управление собственным или арендованным недвижимым имуществом
01.13.51,Выращивание сахарной свеклы
49.39.39,Перевозки пассажиров сухопутным транспортом прочие; не включенные в другие группировки
28.29.22,Производство огнетушителей; распылителей; пароструйных или пескоструйных машин
28.29.13,Производство масляных; бензиновых и всасывающих воздушных фильтров для двигателей внутреннего сгорания
28.29.12,Производство оборудования и установок для фильтрования или очистки жидкостей
33.2,Монтаж промышленных машин и оборудования
26.80,Производство незаписанных магнитных и оптических технических носителей информации
45.32.21,Торговля розничная автомобильными деталями; узлами и принадлежностями через информационно-коммуникационную сеть Интернет
49.39.33,Перевозка пассажиров автобусами в городском и пригородном сообщении по заказам
26.52,Производство часов
26.51,Производство инструментов и приборов для измерения; тестирования и навигации
38.32,Утилизация отсортированных материалов
25.50.1,Предоставление услуг по ковке; прессованию; объемной и листовой штамповке и профилированию листового металла
25.50.2,Предоставление услуг по производству изделий методом порошковой металлургии
49.39.12,Регулярные перевозки пассажиров автобусами в международном сообщении
49.39.13,Специальные перевозки (для собственных нужд) автобусами
28.29.43,Производство торговых автоматов
26.70.6,Производство оптических прицелов и приборов определения координат целей
26.70.5,Производство линз; оптических микроскопов; биноклей и телескопов
26.70.1,Производство фото- и кинооборудования
55.1,Деятельность гостиниц и прочих мест для временного проживания
55.2,Деятельность по предоставлению мест для краткосрочного проживания
26.60,Производство облучающего и электротерапевтического оборудования; применяемого в медицинских целях
38.21,Обработка и утилизация неопасных отходов
53.20.1,Деятельность специальной почтовой связи
38.22,Обработка и утилизация опасных отходов
87.30,Деятельность по уходу за престарелыми и инвалидами с обеспечением проживания
53.20.3,Деятельность курьерская
53.20.2,Деятельность фельдъегерской связи
81.29.1,Дезинфекция; дезинсекция; дератизация зданий; промышленного оборудования
13.99.2,Производство фетра и войлока
13.99.9,Производство текстильных изделий различного назначения; не включенных в другие группировки
20.5,Производство прочих химических продуктов
20.4,Производство мыла и моющих; чистящих и полирующих средств; парфюмерных и косметических средств
20.3,Производство красок; лаков и аналогичных материалов для нанесения покрытий; полиграфических красок и мастик
13.99.1,Производство кружевного сетчатого и гардинно-тюлевого полотна; а также кружев и вышитых изделий; в кусках; в форме полос или отдельных вышивок
20.1,Производство основных химических веществ; удобрений и азотных соединений; пластмасс и синтетического каучука в первичных формах
20.59.5,Производство прочих химических продуктов; не включенных в другие группировки
20.59.4,Производство смазочных материалов; присадок к смазочным материалам и антифризов
26.30,Производство коммуникационного оборудования
38.11,Сбор неопасных отходов
38.12,Сбор опасных отходов
28.99.1,Производство переплетного; наборного; включая фотонаборные машины; печатного оборудования и его составных частей
87.20,Деятельность по оказанию помощи на дому для лиц с ограниченными возможностями развития; душевнобольным и наркозависимым
28.99.3,Производство пусковых устройств для воздушных судов; катапультирующих устройств для воздушных судов и т. п. оборудования
28.99.2,Производство оборудования и аппаратуры для производства полупроводниковых слитков или пластин; полупроводниковых устройств; электронных интегральных микросхем или плоскопанельных дисплеев
99.00,Деятельность экстерриториальных организаций и органов
69.20.1,Деятельность по проведению финансового аудита
69.20.2,Деятельность по оказанию услуг в области бухгалтерского учета
28.99.9,Производство оборудования специального назначения; не включенного в другие группировки
81.29.2,Подметание улиц и уборка снега
69.20.3,Деятельность области налогового консультирования
77.3,Аренда и лизинг прочих машин и оборудования и материальных средств
81.29.9,Деятельность по чистке и уборке прочая; не включенная в другие группировки
16.21.1,Производство фанеры; деревянных фанерованных панелей и аналогичных слоистых материалов; древесных плит из древесины и других одревесневших материалов
77.2,Прокат и аренда предметов личного пользования и хозяйственно-бытового назначения
26.40,Производство бытовой электроники
46.51.1,Торговля оптовая компьютерами и периферийными устройствами
14.31,Производство вязаных и трикотажных чулочно-носочных изделий
46.51.2,Торговля оптовая программным обеспечением
10.72.4,Производство замороженных хлебобулочных полуфабрикатов
26.12,Производство электронных печатных плат
26.11,Производство элементов электронной аппаратуры
01.13.12,Выращивание овощей защищенного грунта
42.1,Строительство автомобильных и железных дорог
42.2,Строительство инженерных коммуникаций
14.39,Производство прочих вязаных и трикотажных изделий
63.99,Деятельность информационных служб прочая; не включенная в другие группировки
45.11.1,Торговля оптовая легковыми автомобилями и легкими автотранспортными средствами
45.11.2,Торговля розничная легковыми автомобилями и легкими автотранспортными средствами в специализированных магазинах
45.19.41,Торговля оптовая прочими автотранспортными средствами через информационно-коммуникационную сеть Интернет за вознаграждение или на договорной основе
45.11.3,Торговля розничная легковыми автомобилями и легкими автотранспортными средствами прочая
45.11.4,Торговля оптовая легковыми автомобилями и легкими автотранспортными средствами за вознаграждение или на договорной основе
01.13.31,Выращивание картофеля
26.20,Производство компьютеров и периферийного оборудования
46.90,Торговля оптовая неспециализированная
63.91,Деятельность информационных агентств
24.43.1,Производство свинца
24.43.2,Производство цинка
35.11.1,Производство электроэнергии тепловыми электростанциями; в том числе деятельность по обеспечению работоспособности электростанций
43.12,Подготовка строительной площадки
43.13,Разведочное бурение
77.39.1,Аренда и лизинг прочих сухопутных транспортных средств и оборудования
77.39.2,Аренда и лизинг прочих машин и оборудования; не включенных в другие группировки
95.11,Ремонт компьютеров и периферийного компьютерного оборудования
95.12,Ремонт коммуникационного оборудования
64.9,Деятельность по предоставлению прочих финансовых услуг; кроме услуг по страхованию и пенсионному обеспечению
64.1,Денежное посредничество
43.11,Разборка и снос зданий
35.11.3,Производство электроэнергии атомными электростанциями; в том числе деятельность по обеспечению работоспособности электростанций
35.11.2,Производство электроэнергии гидроэлектростанциями; в том числе деятельность по обеспечению работоспособности электростанций
35.11.4,Производство электроэнергии; получаемой из возобновляемых источников энергии; включая выработанную солнечными; ветровыми; геотермальными электростанциями; в том числе деятельность по обеспечению их работоспособности
46.42.2,Торговля оптовая обувью
01.43.1,Разведение лошадей; ослов; мулов; лошаков
46.42.1,Торговля оптовая одеждой
86.90.4,Деятельность санаторно-курортных организаций
86.90.3,Деятельность массажных салонов
86.90.2,Деятельность организаций судебно-медицинской экспертизы
86.90.1,Деятельность организаций санитарно-эпидемиологической службы
26.52.1,Производство часов всех видов и прочих приборов времени
26.52.2,Производство часовых механизмов; деталей и составных частей часов и приборов времени
86.90.9,Деятельность в области медицины прочая; не включенная в другие группировки
66.12.3,Деятельность эмиссионная
66.12.2,Деятельность по управлению ценными бумагами
66.12.1,Деятельность биржевых посредников и биржевых брокеров; совершающих товарные фьючерсные и опционные сделки в биржевой торговле
46.12.31,Деятельность агентов по оптовой торговле промышленными и техническими химическими веществами
47.62.1,Торговля розничная газетами и журналами в специализированных магазинах
47.62.2,Торговля розничная писчебумажными и канцелярскими товарами в специализированных магазинах
28.49.12,Производство деревообрабатывающих станков
46.12.21,Деятельность агентов по оптовой торговле рудами
46.12.22,Деятельность агентов по оптовой торговле металлами в первичных формах
95.29,Ремонт прочих предметов личного потребления и бытовых товаров
95.25,Ремонт часов и ювелирных изделий
95.21,Ремонт электронной бытовой техники
95.22,Ремонт бытовых приборов; домашнего и садового инвентаря
95.23,Ремонт обуви и прочих изделий из кожи
31.01,Производство мебели для офисов и предприятий торговли
13.20.2,Производство хлопчатобумажных тканей
46.12.32,Деятельность агентов по оптовой торговле удобрениями и агрохимикатами
31.03,Производство матрасов
